{
  "$schema": "https://json-schema.org/draft/2020-12/schema",
  "$id": "https://github.com/brida-ai/reflexbench/schemas/result-submission-v1.schema.json",
  "title": "ReflexBench v1 result submission envelope",
  "type": "object",
  "additionalProperties": false,
  "required": ["schema", "benchmark_version", "lane", "engine", "adapter", "corpus", "deployment", "run", "metrics", "evidence"],
  "properties": {
    "schema": {"const": "reflexbench.result-submission/v1"},
    "benchmark_version": {"const": "1.0.0"},
    "lane": {"type": "string", "minLength": 1},
    "engine": {
      "type": "object",
      "additionalProperties": false,
      "required": ["owner", "name", "revision"],
      "properties": {
        "owner": {"type": "string", "minLength": 1},
        "name": {"type": "string", "minLength": 1},
        "revision": {"type": "string", "minLength": 1},
        "url": {"type": "string"}
      }
    },
    "adapter": {
      "type": "object",
      "additionalProperties": false,
      "required": ["revision"],
      "properties": {
        "repository": {"type": "string"},
        "revision": {"type": "string", "minLength": 1}
      }
    },
    "corpus": {
      "type": "object",
      "additionalProperties": false,
      "required": ["name", "sha256", "rows"],
      "properties": {
        "name": {"type": "string", "minLength": 1},
        "sha256": {"type": "string", "pattern": "^[0-9a-f]{64}$"},
        "rows": {"type": "integer", "minimum": 1}
      }
    },
    "deployment": {
      "type": "object",
      "additionalProperties": false,
      "required": ["kind"],
      "properties": {
        "kind": {"enum": ["hosted-api", "local-cpu", "local-gpu", "other"]},
        "hardware": {"type": "string"},
        "provider": {"type": "string"},
        "region": {"type": "string"}
      }
    },
    "run": {
      "type": "object",
      "additionalProperties": false,
      "required": ["date", "command", "retry_policy"],
      "properties": {
        "date": {"type": "string", "format": "date"},
        "command": {"type": "string", "minLength": 1},
        "retry_policy": {"type": "string", "minLength": 1}
      }
    },
    "metrics": {
      "type": "object",
      "additionalProperties": true,
      "required": ["completion_rate", "semantic_accuracy"],
      "properties": {
        "completion_rate": {"type": "number", "minimum": 0, "maximum": 1},
        "semantic_accuracy": {"type": "number", "minimum": 0, "maximum": 1},
        "operational_accuracy": {"type": "number", "minimum": 0, "maximum": 1},
        "ece": {"type": ["number", "null"], "minimum": 0},
        "p50_latency_ms": {"type": ["number", "null"], "minimum": 0}
      }
    },
    "evidence": {
      "type": "object",
      "additionalProperties": false,
      "required": ["receipt_paths", "benchmark_used_for_development"],
      "properties": {
        "receipt_paths": {"type": "array", "minItems": 1, "items": {"type": "string", "minLength": 1}},
        "benchmark_used_for_development": {"type": "boolean"},
        "development_note": {"type": "string"}
      }
    }
  }
}
